{
  "title": "Smart Contract Coordination",
  "content": "# Smart Contract Coordination\n\n- ### OntologyBlock\n  id:: smart-contract-coordination-ontology\n  collapsed:: true\n  - ontology:: true\n  - term-id:: TELE-251\n  - preferred-term:: Smart Contract Coordination\n  - alternate-terms::\n  - Blockchain-Based Coordination\n  - Automated Agreement Execution\n  - Self-Executing Contracts for Collaboration\n  - source-domain:: tele\n  - status:: active\n  - public-access:: true\n  - definition:: \"The use of blockchain smart contracts—self-executing programs stored on distributed ledgers—to automate coordination, task allocation, payment distribution, and milestone verification in distributed teams, enabling trustless collaboration through cryptographically enforced agreements that execute deterministically without centralised intermediaries.\"\n  - maturity:: developing\n  - authority-score:: 0.80\n  - owl:class:: tele:SmartContractCoordination\n  - owl:physicality:: ConceptualEntity\n  - owl:role:: Process\n  - belongsToDomain::\n  - [[TELE-0000-telepresence-domain]]\n  - [[BlockchainCollaboration]]\n  - bridges-to::\n  - [[BlockchainDomain]]\n\n\n## Definition\n\n**Smart Contract Coordination** applies blockchain technology to [[TELE-002-telecollaboration]], encoding collaboration rules as immutable smart contracts that automatically enforce agreements. For example, a freelance developer completes a GitHub pull request; a smart contract verifies the merge, then releases payment in cryptocurrency [[TELE-253-cryptocurrency-remuneration]] without requiring escrow agents or manual approvals.\n\n## Use Cases\n\n- **Milestone-Based Payments**: Funds released when deliverables verified on-chain\n- **Multi-Signature Approvals**: Requires M-of-N team signatures to execute decisions\n- **Royalty Distribution**: NFT sales automatically split revenue among contributors\n- **DAO Task Allocation**: Decentralised autonomous organisations [[TELE-252-dao-governance-telecollaboration]] assign tasks via smart contracts\n\n## Advantages\n\n- **Trustless**: No reliance on third-party intermediaries\n- **Transparent**: All transactions auditable on blockchain\n- **Automated**: Execution deterministic, instant upon conditions met\n- **Global**: Cryptocurrency payments bypass banking system\n\n## Challenges\n\n- **Code Bugs**: Smart contract vulnerabilities enable exploits (£3.1B stolen in 2024)\n- **Gas Fees**: Transaction costs £0.50-£50 depending on network congestion\n- **Irreversibility**: Erroneous payments difficult to reverse\n- **Legal Uncertainty**: Smart contract enforceability unclear in UK law\n\n## Related Concepts\n\n- [[TELE-002-telecollaboration]]\n- [[TELE-250-blockchain-collaboration]]\n- [[TELE-252-dao-governance-telecollaboration]]\n- [[SmartContracts]]\n\n## Metadata\n\n- **Term-ID**: TELE-251\n- **Last Updated**: 2025-11-16\n- **Maturity**: Developing\n- **Authority Score**: 0.80",
  "properties": {},
  "backlinks": [
    "TELE-250-blockchain-collaboration",
    "TELE-253-cryptocurrency-remuneration",
    "TELE-252-dao-governance-telecollaboration",
    "TELE-001-telepresence",
    "TELE-002-telecollaboration"
  ],
  "wiki_links": [
    "BlockchainCollaboration",
    "TELE-253-cryptocurrency-remuneration",
    "SmartContracts",
    "TELE-0000-telepresence-domain",
    "TELE-252-dao-governance-telecollaboration",
    "TELE-002-telecollaboration",
    "TELE-250-blockchain-collaboration",
    "BlockchainDomain"
  ],
  "ontology": {
    "term_id": "TELE-251",
    "preferred_term": "Smart Contract Coordination",
    "definition": "\"The use of blockchain smart contracts—self-executing programs stored on distributed ledgers—to automate coordination, task allocation, payment distribution, and milestone verification in distributed teams, enabling trustless collaboration through cryptographically enforced agreements that execute deterministically without centralised intermediaries.\"",
    "source_domain": "tele",
    "maturity_level": null,
    "authority_score": 0.8
  }
}